<?xml version="1.0" encoding="UTF-8"?>
<library xmlns="http://www.example.org/gameLibrary" xmlns:xsi="http://www.w3.org/2001/XMLSchema-instance"
	xsi:schemaLocation="http://www.example.org/gameLibrary gameLibrary.xsd ">
	<game>
		<title>Elderscrolles IV: Skyrim</title>
		<genre>RPG</genre>
		<rating>9</rating>
		<timePlayed>P8DT18H56M23S</timePlayed>
		<price>14.99</price>
	</game>
	<game>
		<title>CS:GO</title>
		<genre>Shooter</genre>
		<rating>8</rating>
		<timePlayed>P40DT9H42M52S</timePlayed>
		<price>9.99</price>
	</game>
</library>
